"","X","accessRights","adm1","adm2","associatedOccurrences","associatedReferences","associatedSequences","associatedTaxa","basisOfRecord","behavior","bibliographicCitation","catalogNumber","class","classKey","cloc","collectionCode","collectionID","continent","coordinatePrecision","coordinateUncertaintyInMeters","country","created","datasetID","datasetKey","datasetName","dateIdentified","day","depth","depthAccuracy","disposition","dynamicProperties","earliestAgeOrLowestStage","earliestEonOrLowestEonothem","earliestEpochOrLowestSeries","earliestEraOrLowestErathem","earliestPeriodOrLowestSystem","elevation","elevationAccuracy","endDayOfYear","establishmentMeans","eventDate","eventID","eventRemarks","eventTime","family","familyKey","fieldNotes","fieldNumber","formation","fullCountry","gbifID","genericName","genus","genusKey","geodeticDatum","geologicalContextID","georeferencedBy","georeferencedDate","georeferenceProtocol","georeferenceRemarks","georeferenceSources","georeferenceVerificationStatus","habitat","higherClassification","higherGeography","highestBiostratigraphicZone","http...unknown.org.occurrenceDetails","http...unknown.org.organismID","identificationID","identificationQualifier","identificationReferences","identificationRemarks","identificationVerificationStatus","identifiedBy","identifier","individualCount","informationWithheld","infraspecificEpithet","institutionCode","institutionID","island","islandGroup","ISO2","key","kingdom","kingdomKey","language","lastCrawled","lastInterpreted","lastParsed","lat","latestAgeOrHighestStage","latestEonOrHighestEonothem","latestEpochOrHighestSeries","latestEraOrHighestErathem","latestPeriodOrHighestSystem","license","lifeStage","locality","locationAccordingTo","locationID","locationRemarks","lon","lowestBiostratigraphicZone","modified","month","municipality","nomenclaturalCode","occurrenceID","occurrenceRemarks","occurrenceStatus","order","orderKey","organismID","otherCatalogNumbers","ownerInstitutionCode","parentNameUsage","phylum","phylumKey","preparations","previousIdentifications","protocol","publishingCountry","publishingOrgKey","recordedBy","recordNumber","references","reproductiveCondition","rights","rightsHolder","samplingProtocol","scientificName","scientificNameID","sex","source","species","speciesKey","specificEpithet","startDayOfYear","taxonID","taxonKey","taxonomicStatus","taxonRank","taxonRemarks","type","typeStatus","typifiedName","verbatimCoordinateSystem","verbatimElevation","verbatimEventDate","verbatimLocality","verbatimTaxonRank","vernacularName","waterBody","year","downloadDate","id_no","binomial","presence","origin","seasonal","compiler","year.1","citation","source.1","dist_comm","island.1","kingdom.1","phylum.1","class.1","order_","family.1","rlcategory","shape_Leng","shape_Area","optional"
"317",317,"http://www.vertnet.org/resources/norms.html","Alaska",NA,NA,NA,NA,NA,"PRESERVED_SPECIMEN",NA,NA,"117483","Mammalia",359,"Alaska Peninsula, Little Alinchak Bay Alaska,USA Karluk Quad, Alaska, United States, NORTH_AMERICA","Mammal specimens","urn:lsid:biocol.org:col:34889","NORTH_AMERICA",NA,100,"United States",NA,NA,"377be098-626f-4cc2-b4b5-35700050669a",NA,"2013-05-30T00:00:00.000+0000",30,NA,NA,NA,"sex=female ; total length=1127 mm; tail length=422 mm; hind foot with claw=135 mm; ear from notch=21 mm; weight=18 lb; reproductive data=plsc(2,2)",NA,NA,NA,NA,NA,NA,NA,150,NA,"2013-05-30T00:00:00.000+0000",NA,NA,NA,"Mustelidae",5307,NA,NA,NA,"United States",897013828,"Lontra","Lontra",2433726,"WGS84",NA,"Jack J. Withrow","2013-05-30 00:00:00.0","not recorded",NA,"GPS","unverified",NA,"Animalia; Chordata; Mammalia; Carnivora; Mustelidae; Lutrinae;  (Schreber, 1777)","North America, United States, Alaska, Karluk Quad",NA,NA,NA,NA,"A",NA,NA,"field","Jack J. Withrow","http://arctos.database.museum/guid/UAM:Mamm:117483?seid=1992211",1,NA,NA,"UAM","urn:lsid:biocol.org:col:34847",NA,NA,"US",897013828,"Animalia",1,"en","2016-08-09T08:05:45.365+0000","2016-08-09T08:06:05.350+0000","2016-08-09T08:05:46.102+0000",57.7913,NA,NA,NA,NA,NA,NA,NA,"Alaska Peninsula, Little Alinchak Bay Alaska,USA Karluk Quad","Jack J. Withrow",NA,NA,-155.3293,NA,NA,5,NA,"ICZN","http://arctos.database.museum/guid/UAM:Mamm:117483?seid=1992211",NA,NA,"Carnivora",732,"http://arctos.database.museum/guid/UAM:Mamm:117483","AF=70988",NA,NA,"Chordata",44,"skin; skull; postcranial skeleton; tissue (frozen); tissue (frozen); tissue (frozen); tissue (frozen); tissue (frozen)","<i>Lontra canadensis</i> (accepted ID) identified by Jack J. Withrow on 2013-05-30; method: field","DWC_ARCHIVE","US","d9699a79-4736-45c2-925c-f4033ac67d52","Collector(s): Jack J. Withrow; Preparator(s): Takae Nakajima, Jonathan A. Nations",NA,"http://arctos.database.museum/guid/UAM:Mamm:117483",NA,"http://arctosdb.org/home/data/",NA,NA,"Lontra canadensis (Schreber, 1777)",NA,"FEMALE",NA,"Lontra canadensis",2433727,"canadensis",NA,NA,2433727,NA,"SPECIES",NA,"PhysicalObject",NA,NA,"decimal degrees",NA,"30 May 2013","Alaska Peninsula, Little Alinchak Bay Alaska,USA Karluk Quad.",NA,NA,NA,2013,"2016-08-10",12302,"Lontra canadensis",1,1,1,"IUCN",2015,"IUCN (International Union for Conservation of Nature)",NA,NA,NA,"ANIMALIA","CHORDATA","MAMMALIA","CARNIVORA","MUSTELIDAE","LC",3599.99814602,2704.15378574,TRUE
"409",409,"http://www.vertnet.org/resources/norms.html","Alaska",NA,NA,NA,NA,NA,"PRESERVED_SPECIMEN",NA,NA,"115822","Mammalia",359,"Deadman Bay Kodiak Arch., Alaska, United States, NORTH_AMERICA","Mammal specimens","urn:lsid:biocol.org:col:34889","NORTH_AMERICA",NA,402.34,"United States",NA,NA,"377be098-626f-4cc2-b4b5-35700050669a",NA,"2012-12-17T00:00:00.000+0000",17,NA,NA,NA,"sex=male ; total length=1244 mm; tail length=416 mm; hind foot with claw=138 mm; ear from notch=24 mm; weight=10.2 kg; reproductive data=T=35x21",NA,NA,NA,NA,NA,NA,NA,352,NA,"2012-12-17T00:00:00.000+0000",NA,NA,NA,"Mustelidae",5307,NA,NA,NA,"United States",897012004,"Lontra","Lontra",2433726,"WGS84",NA,"Jack J. Withrow","2012-12-17 00:00:00.0","not recorded",NA,"Google Earth","unverified",NA,"Animalia; Chordata; Mammalia; Carnivora; Mustelidae; Lutrinae;  (Schreber, 1777)","North America, United States, Alaska, Kodiak Quad, Kodiak Archipelago",NA,NA,NA,NA,"A",NA,NA,"field","Jack J. Withrow","http://arctos.database.museum/guid/UAM:Mamm:115822?seid=1952379",1,NA,NA,"UAM","urn:lsid:biocol.org:col:34847",NA,"Kodiak Archipelago","US",897012004,"Animalia",1,"en","2016-08-09T08:05:44.725+0000","2016-08-09T08:06:02.179+0000","2016-08-09T08:05:45.246+0000",57.089,NA,NA,NA,NA,NA,NA,NA,"Deadman Bay Kodiak Arch.","Jack J. Withrow",NA,NA,-153.871,NA,NA,12,NA,"ICZN","http://arctos.database.museum/guid/UAM:Mamm:115822?seid=1952379",NA,NA,"Carnivora",732,"http://arctos.database.museum/guid/UAM:Mamm:115822","AF=70984",NA,NA,"Chordata",44,"skin; skull; postcranial skeleton; spleen (frozen); heart (frozen); kidney (frozen); liver (frozen)","<i>Lontra canadensis</i> (accepted ID) identified by Jack J. Withrow on 2012-12-17; method: field","DWC_ARCHIVE","US","d9699a79-4736-45c2-925c-f4033ac67d52","Collector(s): Jack J. Withrow; Preparator(s): Takae Nakajima",NA,"http://arctos.database.museum/guid/UAM:Mamm:115822",NA,"http://arctosdb.org/home/data/",NA,NA,"Lontra canadensis (Schreber, 1777)",NA,"MALE",NA,"Lontra canadensis",2433727,"canadensis",NA,NA,2433727,NA,"SPECIES",NA,"PhysicalObject",NA,NA,"decimal degrees",NA,"17 Dec 2012","Deadman Bay Kodiak Arch.",NA,NA,NA,2012,"2016-08-10",12302,"Lontra canadensis",1,1,1,"IUCN",2015,"IUCN (International Union for Conservation of Nature)",NA,NA,"Kodiak","ANIMALIA","CHORDATA","MAMMALIA","CARNIVORA","MUSTELIDAE","LC",20.5898740879,1.43094502812,TRUE
"548",552,"http://www.vertnet.org/resources/norms.html","Alaska",NA,NA,NA,NA,NA,"PRESERVED_SPECIMEN",NA,NA,"222903","Mammalia",359,"Pow Island, Alaska, United States, NORTH_AMERICA","Mammal specimens",NA,"NORTH_AMERICA",NA,NA,"United States",NA,NA,"b15d4952-7d20-46f1-8a3e-556a512b04c5",NA,"2009-12-06T00:00:00.000+0000",6,NA,NA,NA,"sex=female",NA,NA,NA,NA,NA,NA,NA,340,NA,"2009-12-06T00:00:00.000+0000",NA,NA,NA,"Mustelidae",5307,NA,NA,NA,"United States",1145255980,"Lontra","Lontra",2433726,"WGS84",NA,"L. Dickerson","2009-12-06 00:00:00.0","not recorded",NA,"Not Recorded","unverified",NA,"Animalia; Chordata; Mammalia; Carnivora; Mustelidae; Lutrinae;  (Schreber, 1777)","North America, United States, Alaska, Alexander Archipelago, Prince of Wales Island",NA,NA,NA,NA,"A",NA,NA,"field","L. Dickerson","http://arctos.database.museum/guid/MSB:Mamm:222903?seid=1601547",1,NA,NA,"MSB","urn:lsid:biocol.org:col:34495","Prince of Wales Island","Alexander Archipelago","US",1145255980,"Animalia",1,"en","2016-07-28T04:55:51.354+0000","2016-08-04T12:19:00.791+0000","2016-06-24T04:33:44.500+0000",55.734,NA,NA,NA,NA,NA,NA,NA,"Pow Island","L. Dickerson",NA,NA,-132.98931,NA,NA,12,NA,"ICZN","http://arctos.database.museum/guid/MSB:Mamm:222903?seid=1601547","Box 3 of 6",NA,"Carnivora",732,"http://arctos.database.museum/guid/MSB:Mamm:222903","NK=196016",NA,NA,"Chordata",44,"skull; tongue (frozen); muscle (frozen)","<i>Lontra canadensis</i> (accepted ID) identified by L. Dickerson on 2009-12-06; method: field","DWC_ARCHIVE","US","939ed180-aa7b-11db-8edf-b8a03c50a862","Collector(s): L. Dickerson; Preparator(s): Ashley Smiley",NA,"http://arctos.database.museum/guid/MSB:Mamm:222903",NA,"http://arctosdb.org/home/data/",NA,NA,"Lontra canadensis (Schreber, 1777)",NA,"FEMALE",NA,"Lontra canadensis",2433727,"canadensis",NA,NA,2433727,NA,"SPECIES",NA,"PhysicalObject",NA,NA,"deg. min. sec.",NA,"2009-12-06","Pow Island",NA,NA,NA,2009,"2016-08-10",12302,"Lontra canadensis",1,1,1,"IUCN",2015,"IUCN (International Union for Conservation of Nature)",NA,NA,"Prince of Wales","ANIMALIA","CHORDATA","MAMMALIA","CARNIVORA","MUSTELIDAE","LC",23.5683024664,0.924802384275,TRUE
"555",559,"http://www.vertnet.org/resources/norms.html","California","Marin County",NA,NA,NA,NA,"PRESERVED_SPECIMEN",NA,NA,"223471","Mammalia",359,"W side Nicasio Reservoir on Point Reyes-Petaluma Rd., 3 km WSW junction with Nicasio Valley Rd, California, Marin County, United States, NORTH_AMERICA","Mammal specimens","urn:lsid:biocol.org:col:34904","NORTH_AMERICA",NA,82.08,"United States",NA,NA,"0daed095-478a-4af6-abf5-18acb790fbb2",NA,"2009-04-24T00:00:00.000+0000",29,NA,NA,NA,"sex=female ; total length=1080 mm; tail length=410 mm; hind foot with claw=130 mm; ear from notch=17 mm; weight=6882 g; reproductive data=4 nipples showing, no embryos or obvious scars in uteri ; stomach contents=fish bones",NA,NA,NA,NA,NA,NA,NA,29,NA,"2008-01-29T00:00:00.000+0000",NA,"Found dead on road and salvaged by Peter Pyle.",NA,"Mustelidae",5307,NA,NA,NA,"United States",1145802597,"Lontra","Lontra",2433726,"WGS84",NA,"Pascal Title","2009-05-19 00:00:00.0","MaNIS georeferencing guidelines",NA,"Google Earth Pro 5.0, TeleAtlas, eye alt. 2800 ft","unverified",NA,"Animalia; Chordata; Mammalia; Carnivora; Mustelidae; Lutrinae;","North America, United States, California, Marin County",NA,NA,NA,NA,"A",NA,NA,"geographic distribution","Christopher J. Conroy","http://arctos.database.museum/guid/MVZ:Mamm:223471?seid=1189526",1,NA,NA,"MVZ","urn:lsid:biocol.org:col:34777",NA,NA,"US",1145802597,"Animalia",1,"en","2016-08-09T09:39:00.409+0000","2016-08-09T09:41:45.898+0000","2016-08-09T09:39:01.047+0000",38.08615,NA,NA,NA,NA,NA,NA,NA,"W side Nicasio Reservoir on Point Reyes-Petaluma Rd., 3 km WSW junction with Nicasio Valley Rd","Pascal Title",NA,"W edge of Nicasio Reservoir. Verbatim locality very different. Revised locality with image received from collector 24 April 2009. CJC.",-122.75275,NA,NA,1,NA,"ICZN","http://arctos.database.museum/guid/MVZ:Mamm:223471?seid=1189526","Specimen prepared by Olga Sanchez, Daisy Guardado, Holvis Delgadillo and Monica Albe. Head and body skeleton smashed, liver liquified. Four tubes of tissue taken during preparation, but were lost during curation process. Have been searched for multiple times. If found, update record.    4 tissue tubes (H, Lung, M, K) found.  These tubes are now included in the mammal tissues Google doc. (RW 6 Nov 2012)",NA,"Carnivora",732,"http://arctos.database.museum/guid/MVZ:Mamm:223471","MVZ Prep Lab Catalog=647",NA,NA,"Chordata",44,"skull; tissue (frozen); tissue (frozen); tissue (frozen); tissue (frozen); study skin; skeleton","<i>Lontra canadensis brevipilosus</i> (accepted ID) identified by Christopher J. Conroy on 2009-04-24; method: geographic distribution","DWC_ARCHIVE","US","8edbbde0-055e-11d8-b850-b8a03c50a862","Collector(s): Monica J. Albe, Peter Pyle",NA,"http://arctos.database.museum/guid/MVZ:Mamm:223471",NA,"http://creativecommons.org/publicdomain/zero/1.0/",NA,NA,"Lontra canadensis (Schreber, 1777)",NA,"FEMALE",NA,"Lontra canadensis",2433727,"canadensis",NA,NA,2433727,NA,"SPECIES",NA,"PhysicalObject",NA,NA,"decimal degrees",NA,"29 Jan 2008","3 km WSW of Nicasio, along Petaluma-Point Reyes Hwy., W edge of Nicasio Reservoir, Marin County, California",NA,NA,NA,2008,"2016-08-10",12302,"Lontra canadensis",1,1,1,"IUCN",2015,"IUCN (International Union for Conservation of Nature)",NA,NA,NA,"ANIMALIA","CHORDATA","MAMMALIA","CARNIVORA","MUSTELIDAE","LC",3599.99814602,2704.15378574,TRUE
"603",607,"http://vertnet.org/resources/norms.html","Colorado","Grand County",NA,NA,NA,NA,"PRESERVED_SPECIMEN",NA,NA,"11106","Mammalia",359,"along Williams Fork, Colorado, Grand County, United States, NORTH_AMERICA","Mammal specimens",NA,"NORTH_AMERICA",NA,NA,"United States",NA,NA,"5f3463d2-51b6-4a8a-b252-9bab4388934e",NA,"2007-04-02T00:00:00.000+0000",2,NA,NA,NA,"sex=female ; total length=107 cm; tail length=44 cm; hind foot with claw=30 cm; ear from notch=21 cm; weight=6.932 kg",NA,NA,NA,NA,NA,NA,NA,92,NA,"2007-04-02T00:00:00.000+0000",NA,NA,NA,"Mustelidae",5307,NA,NA,NA,"United States",1145095472,"Lontra","Lontra",2433726,"WGS84",NA,"Lance Carpenter","2007-04-02 00:00:00.0","not recorded",NA,"unknown","verified by collector",NA,"Animalia; Chordata; Mammalia; Carnivora; Mustelidae; Lutrinae;  (Schreber, 1777)","North America, United States, Colorado, Grand County",NA,NA,NA,NA,"A",NA,NA,"expert","Lance Carpenter","http://arctos.database.museum/guid/DMNS:Mamm:11106?seid=1155386",1,NA,NA,"DMNS","urn:lsid:biocol.org:col:35013",NA,NA,"US",1145095472,"Animalia",1,"en","2016-07-28T04:44:41.577+0000","2016-08-04T00:09:32.458+0000","2016-06-24T04:06:43.309+0000",39.8837,NA,NA,NA,NA,NA,NA,NA,"along Williams Fork","Lance Carpenter",NA,NA,-106.092,NA,NA,4,NA,"ICZN","http://arctos.database.museum/guid/DMNS:Mamm:11106?seid=1155386","No parasites found.",NA,"Carnivora",732,"http://arctos.database.museum/guid/DMNS:Mamm:11106","DZTM: Denver Zoology Tissue Mammal=101; preparator number=XM.2410",NA,NA,"Chordata",44,"liver (frozen); heart (frozen); kidney (frozen); study skin; skeleton","<i>Lontra canadensis</i> (accepted ID) identified by Lance Carpenter on 2007-04-02; method: expert","DWC_ARCHIVE","US","a2ef6dd1-8886-48c9-8025-c62bac973cc7","Collector(s): Lance Carpenter; Preparator(s): Jeffrey T. Stephenson, Betsy Byrne",NA,"http://arctos.database.museum/guid/DMNS:Mamm:11106",NA,"http://creativecommons.org/licenses/by-nc/3.0",NA,"Salvage, road kill","Lontra canadensis (Schreber, 1777)",NA,"FEMALE",NA,"Lontra canadensis",2433727,"canadensis",NA,NA,2433727,NA,"SPECIES",NA,"PhysicalObject",NA,NA,"decimal degrees",NA,"2 April 2007","along Williams Fork",NA,NA,NA,2007,"2016-08-10",12302,"Lontra canadensis",1,1,1,"IUCN",2015,"IUCN (International Union for Conservation of Nature)",NA,NA,NA,"ANIMALIA","CHORDATA","MAMMALIA","CARNIVORA","MUSTELIDAE","LC",3599.99814602,2704.15378574,TRUE
"605",609,"http://vertnet.org/resources/norms.html","Colorado","Grand County",NA,NA,NA,NA,"PRESERVED_SPECIMEN",NA,NA,"11107","Mammalia",359,"Pole Creek, Colorado, Grand County, United States, NORTH_AMERICA","Mammal specimens",NA,"NORTH_AMERICA",NA,NA,"United States",NA,NA,"5f3463d2-51b6-4a8a-b252-9bab4388934e",NA,"2007-04-02T00:00:00.000+0000",2,NA,NA,NA,"sex=male ; total length=116 cm; tail length=41.5 cm; hind foot with claw=12.5 cm; ear from notch=1.7 cm; weight=6.8 kg",NA,NA,NA,NA,NA,NA,NA,92,NA,"2007-04-02T00:00:00.000+0000",NA,NA,NA,"Mustelidae",5307,NA,NA,NA,"United States",1145095415,"Lontra","Lontra",2433726,"WGS84",NA,"Lance Carpenter","2007-04-02 00:00:00.0","not recorded",NA,"unknown","unverified",NA,"Animalia; Chordata; Mammalia; Carnivora; Mustelidae; Lutrinae;  (Schreber, 1777)","North America, United States, Colorado, Grand County",NA,NA,NA,NA,"A",NA,NA,"expert","Lance Carpenter","http://arctos.database.museum/guid/DMNS:Mamm:11107?seid=1189531",1,NA,NA,"DMNS","urn:lsid:biocol.org:col:35013",NA,NA,"US",1145095415,"Animalia",1,"en","2016-07-28T04:44:41.555+0000","2016-08-04T00:09:33.143+0000","2016-06-24T04:06:43.205+0000",39.9835,NA,NA,NA,NA,NA,NA,NA,"Pole Creek","Lance Carpenter",NA,NA,-105.8785,NA,NA,4,NA,"ICZN","http://arctos.database.museum/guid/DMNS:Mamm:11107?seid=1189531","No parasites found.",NA,"Carnivora",732,"http://arctos.database.museum/guid/DMNS:Mamm:11107","DZTM: Denver Zoology Tissue Mammal=104; secondary identifier=XM2413",NA,NA,"Chordata",44,"study skin; skeleton; liver (frozen); kidney (frozen); heart (frozen)","<i>Lontra canadensis</i> (accepted ID) identified by Lance Carpenter on 2007-04-02; method: expert","DWC_ARCHIVE","US","a2ef6dd1-8886-48c9-8025-c62bac973cc7","Collector(s): Lance Carpenter, Tiffany Miller; Preparator(s): Betsy Byrne",NA,"http://arctos.database.museum/guid/DMNS:Mamm:11107",NA,"http://creativecommons.org/licenses/by-nc/3.0",NA,"Salvage, road kill","Lontra canadensis (Schreber, 1777)",NA,"MALE",NA,"Lontra canadensis",2433727,"canadensis",NA,NA,2433727,NA,"SPECIES",NA,"PhysicalObject",NA,NA,"decimal degrees",NA,"2 April 2007","Pole Creek",NA,NA,NA,2007,"2016-08-10",12302,"Lontra canadensis",1,1,1,"IUCN",2015,"IUCN (International Union for Conservation of Nature)",NA,NA,NA,"ANIMALIA","CHORDATA","MAMMALIA","CARNIVORA","MUSTELIDAE","LC",3599.99814602,2704.15378574,TRUE
"715",720,"http://www.vertnet.org/resources/norms.html","Texas","Chambers County",NA,NA,NA,NA,"PRESERVED_SPECIMEN",NA,NA,"143829","Mammalia",359,"High Island, 5 mi N TX Hwy. 124, Texas, Chambers County, United States, NORTH_AMERICA","Mammal specimens",NA,"NORTH_AMERICA",NA,NA,"United States",NA,NA,"b15d4952-7d20-46f1-8a3e-556a512b04c5",NA,"2006-01-26T00:00:00.000+0000",16,NA,NA,NA,"sex=female ; total length=1132 mm; tail length=445 mm; hind foot with claw=129 mm; ear from notch=22 mm; weight=8.25 kg; reproductive data=No uterine scars, corpora lutea nor Graf-follicles",NA,NA,NA,NA,NA,1.22,0,106,NA,"2005-04-16T00:00:00.000+0000",NA,NA,NA,"Mustelidae",5307,NA,NA,NA,"United States",1145170280,"Lontra","Lontra",2433726,"WGS84",NA,"unknown","2005-04-16 00:00:00.0","not recorded",NA,"collector's notation","unverified",NA,"Animalia; Chordata; Mammalia; Carnivora; Mustelidae; Lutrinae;  (Schreber, 1777)","North America, United States, Texas, Chambers County",NA,NA,NA,NA,"A",NA,NA,"expert","Paul J. Polechla Jr.","http://arctos.database.museum/guid/MSB:Mamm:143829?seid=749155",1,NA,NA,"MSB","urn:lsid:biocol.org:col:34495",NA,NA,"US",1145170280,"Animalia",1,"en","2016-07-28T04:55:30.934+0000","2016-08-04T12:18:24.576+0000","2016-06-24T04:32:58.866+0000",29.63611,NA,NA,NA,NA,NA,NA,NA,"High Island, 5 mi N TX Hwy. 124","unknown",NA,NA,-94.3725,NA,NA,4,NA,"ICZN","http://arctos.database.museum/guid/MSB:Mamm:143829?seid=749155","Assisted by Jaquetta Lee, Tyrell Jim, Cordell Hoskie, Jonathon Wilson, Alyssa Spencer, Kaylene Morris, Carolynne Saffer, R Scott Saffer, and  also by Melissa Hawkins",NA,"Carnivora",732,"http://arctos.database.museum/guid/MSB:Mamm:143829","NK=135478",NA,NA,"Chordata",44,"skin; postcranial skeleton; liver (frozen); lung (frozen); spleen (frozen); muscle (frozen); muscle (frozen) sample; liver (frozen) sample","<i>Lontra canadensis</i> (accepted ID) identified by Paul J. Polechla Jr. on 2006-01-26; method: expert","DWC_ARCHIVE","US","939ed180-aa7b-11db-8edf-b8a03c50a862","Collector(s): Robert W. Dickerman, Carnivore Initiative Project; Preparator(s): Paul J. Polechla Jr.",NA,"http://arctos.database.museum/guid/MSB:Mamm:143829",NA,"http://arctosdb.org/home/data/",NA,NA,"Lontra canadensis (Schreber, 1777)",NA,"FEMALE",NA,"Lontra canadensis",2433727,"canadensis",NA,NA,2433727,NA,"SPECIES",NA,"PhysicalObject",NA,NA,"deg. min. sec.",NA,"16 Apr 2005","High Island, 5 mi N TX Hwy. 124",NA,NA,NA,2005,"2016-08-10",12302,"Lontra canadensis",1,1,1,"IUCN",2015,"IUCN (International Union for Conservation of Nature)",NA,NA,NA,"ANIMALIA","CHORDATA","MAMMALIA","CARNIVORA","MUSTELIDAE","LC",3599.99814602,2704.15378574,TRUE
"716",721,"http://www.vertnet.org/resources/norms.html","California","Yolo County",NA,NA,NA,NA,"PRESERVED_SPECIMEN",NA,NA,"218736","Mammalia",359,"Rd. 13, 2 mi E of the intersection with Hwy. 99 W at Zamora, California, Yolo County, United States, NORTH_AMERICA","Mammal specimens","urn:lsid:biocol.org:col:34904","NORTH_AMERICA",NA,341.18,"United States",NA,NA,"0daed095-478a-4af6-abf5-18acb790fbb2",NA,"2005-06-21T00:00:00.000+0000",21,NA,NA,NA,"sex=female ; total length=119 cm; tail length=45.5 cm; hind foot with claw=20.2 cm; ear from notch=2.8 cm; weight=10.1 kg; reproductive data=Nipples prominent",NA,NA,NA,NA,NA,NA,NA,172,NA,"2005-06-21T00:00:00.000+0000",NA,"DOR",NA,"Mustelidae",5307,NA,NA,NA,"United States",1145797361,"Lontra","Lontra",2433726,"WGS84",NA,"Patrick K. Tam","2008-03-24 00:00:00.0","MaNIS georeferencing guidelines",NA,"Terrain Navigator Prov.7.0,Sacramento,1994,USGS 1:24,000","unverified",NA,"Animalia; Chordata; Mammalia; Carnivora; Mustelidae; Lutrinae;","North America, United States, California, Yolo County",NA,NA,NA,NA,"A",NA,NA,"field","Alan B. Shabel","http://arctos.database.museum/guid/MVZ:Mamm:218736?seid=999596",1,NA,NA,"MVZ","urn:lsid:biocol.org:col:34777",NA,NA,"US",1145797361,"Animalia",1,"en","2016-08-09T09:38:57.454+0000","2016-08-09T09:41:28.440+0000","2016-08-09T09:38:58.250+0000",38.79383,NA,NA,NA,NA,NA,NA,NA,"Rd. 13, 2 mi E of the intersection with Hwy. 99 W at Zamora","Patrick K. Tam",NA,NA,-121.8423,NA,NA,6,NA,"ICZN","http://arctos.database.museum/guid/MVZ:Mamm:218736?seid=999596","Carcass in poor condition, crepitus, green skin; LCA 42",NA,"Carnivora",732,"http://arctos.database.museum/guid/MVZ:Mamm:218736","collector number=178",NA,NA,"Chordata",44,"skull; postcranial skeleton","<i>Lontra canadensis brevipilosus</i> (accepted ID) identified by Alan B. Shabel on 2005-06-21; method: field","DWC_ARCHIVE","US","8edbbde0-055e-11d8-b850-b8a03c50a862","Collector(s): Alan B. Shabel","178","http://arctos.database.museum/guid/MVZ:Mamm:218736",NA,"http://creativecommons.org/publicdomain/zero/1.0/",NA,NA,"Lontra canadensis (Schreber, 1777)",NA,"FEMALE",NA,"Lontra canadensis",2433727,"canadensis",NA,NA,2433727,NA,"SPECIES",NA,"PhysicalObject",NA,NA,"decimal degrees",NA,"21 June 2005","Rd. 13, 2 mi E of the intersection with Hwy. 99 W at Zamora, Yolo Co., California",NA,NA,NA,2005,"2016-08-10",12302,"Lontra canadensis",1,1,1,"IUCN",2015,"IUCN (International Union for Conservation of Nature)",NA,NA,NA,"ANIMALIA","CHORDATA","MAMMALIA","CARNIVORA","MUSTELIDAE","LC",3599.99814602,2704.15378574,TRUE
"747",752,NA,"Ohio","Trumbull",NA,NA,NA,NA,"PRESERVED_SPECIMEN",NA,NA,"OSUM Mammals 6156","Mammalia",359,"Grand River Wildlife Area, Trumbull Co., Ohio, USA, Ohio, Trumbull, United States","Mammals",NA,NA,NA,NA,"United States",NA,NA,"78dcfcbd-03c4-4d47-8618-830aac6f2ee5",NA,"2013-01-01T00:00:00.000+0000",30,NA,NA,NA,NA,NA,NA,NA,NA,NA,NA,NA,NA,NA,"2004-01-30T00:00:00.000+0000",NA,NA,NA,"Mustelidae",5307,"skull only; Location:(cabinet:101 drawer:7 institutionCode:TM; Preparation:skull; verbatimLocality:Grand River Wildlife Area; Trumbull Co.; Ohio; United States",NA,NA,"United States",861700583,"Lontra","Lontra",2433726,"WGS84",NA,NA,NA,NA,NA,"GeoNames (Auto-Correction)",NA,NA,NA,NA,NA,NA,NA,NA,NA,NA,NA,NA,NA,"urn:lsid:biosci.ohio-state.edu:osuc_occurrences:OSUM__Mammals__6156",1,NA,NA,"Ohio State University - Mammal Division, Columbus, OH (OSUM)",NA,NA,NA,"US",861700583,"Animalia",1,"en","2015-09-11T14:25:48.300+0000","2016-08-04T02:28:05.814+0000","2015-07-24T14:21:18.076+0000",40.8424,NA,NA,NA,NA,NA,NA,"ADULT","Grand River Wildlife Area, Trumbull Co., Ohio, USA",NA,NA,NA,-83.3044,NA,"2015-02-09T15:46:46.000+0000",1,NA,NA,"urn:lsid:biosci.ohio-state.edu:osuc_occurrences:OSUM__Mammals__6156",NA,NA,"Carnivora",732,NA,NA,NA,NA,"Chordata",44,"skull within unspecified",NA,"DWC_ARCHIVE","US","5ffa575c-fcd4-4583-9611-545f67b04316",NA,NA,NA,NA,NA,NA,"none specified","Lontra canadensis (Schreber, 1777)","urn:lsid:biosci.ohio-state.edu:osuc_names:298932",NA,"http://hol.osu.edu/spmInfo.html?id=OSUM%20Mammals%206156","Lontra canadensis",2433727,"canadensis",NA,NA,2433727,NA,"SPECIES",NA,NA,NA,NA,NA,NA,"30 January 2004",NA,NA,NA,NA,2004,"2016-08-10",12302,"Lontra canadensis",1,1,1,"IUCN",2015,"IUCN (International Union for Conservation of Nature)",NA,NA,NA,"ANIMALIA","CHORDATA","MAMMALIA","CARNIVORA","MUSTELIDAE","LC",3599.99814602,2704.15378574,TRUE
